{
	"children": [
		{
			"type": "shape",
			"visible": true,
			"style": {
				"stroke": {
					"type": "none"
				},
				"fill": {
					"type": "gradient",
					"gradient": {
						"units": "userSpaceOnUse",
						"r": 300,
						"cx": 400,
						"cy": 300,
						"ref": "radial-gradient"
					}
				}
			},
			"shape": {
				"type": "rect",
				"x": 50,
				"y": 500,
				"width": 200,
				"height": 100
			},
			"visualBounds": {
				"x": 50,
				"y": 500,
				"width": 200,
				"height": 100
			}
		}
	],
	"resources": {
		"clipPaths": {},
		"filters": {},
		"gradients": {
			"radial-gradient": {
				"stops": [
					{
						"offset": 0,
						"color": {
							"mode": "RGB",
							"value": {
								"r": 255,
								"g": 0.003891,
								"b": 0.003891
							},
							"alpha": 1
						}
					},
					{
						"offset": 0.14990234375,
						"color": {
							"mode": "RGB",
							"value": {
								"r": 255,
								"g": 0,
								"b": 255
							}
						}
					},
					{
						"offset": 0.330078125,
						"color": {
							"mode": "RGB",
							"value": {
								"r": 0,
								"g": 0,
								"b": 255
							}
						}
					},
					{
						"offset": 0.489990234375,
						"color": {
							"mode": "RGB",
							"value": {
								"r": 0,
								"g": 255,
								"b": 255
							}
						}
					},
					{
						"offset": 0.669921875,
						"color": {
							"mode": "RGB",
							"value": {
								"r": 0,
								"g": 255,
								"b": 0
							}
						}
					},
					{
						"offset": 0.840087890625,
						"color": {
							"mode": "RGB",
							"value": {
								"r": 255,
								"g": 255,
								"b": 0
							}
						}
					},
					{
						"offset": 1,
						"color": {
							"mode": "RGB",
							"value": {
								"r": 255,
								"g": 0.003891,
								"b": 0.003891
							},
							"alpha": 1
						}
					}
				],
				"type": "radial"
			}
		},
		"masks": {},
		"patterns": {}
	},
	"artboards": {},
	"meta": {
		"PS": {
			"globalLight": {
				"angle": 120,
				"altitude": 30
			}
		}
	},
	"version": "1.5.0",
	"viewSource": {
		"x": 0,
		"y": 0,
		"width": 800,
		"height": 600
	},
	"rasterResolution": 72
}