{
	"children": [
		{
			"type": "text",
			"visible": true,
			"style": {
				"writing-mode": "tb",
				"glyph-orientation-vertical": "0",
				"font-size": 63.6352,
				"stroke": {
					"type": "none"
				}
			},
			"name": "This is a text",
			"visualBounds": {
				"x": 321,
				"y": 241,
				"width": 36,
				"height": 724
			},
			"position": {
				"x": 338.33593856,
				"y": 231.55468288,
				"unitX": "px",
				"unitY": "px"
			},
			"maxTextSize": 63.6352,
			"children": [
				{
					"type": "tspan",
					"visible": true,
					"style": {
						"font-size": 63.6352,
						"fill": {
							"type": "solid",
							"color": {
								"mode": "RGB",
								"value": {
									"r": 3,
									"g": 3,
									"b": 3
								},
								"alpha": 1
							}
						},
						"font-family": "\"Minion Pro\""
					},
					"text": "This is a text",
					"visualBounds": {
						"x": 321,
						"y": 241,
						"width": 36,
						"height": 724
					},
					"position": {
						"x": 338.33593856,
						"y": 0,
						"unitX": "px",
						"unitY": "em"
					}
				}
			]
		}
	],
	"resources": {
		"clipPaths": {},
		"filters": {},
		"gradients": {},
		"masks": {},
		"patterns": {}
	},
	"artboards": {},
	"meta": {
		"PS": {
			"globalLight": {
				"angle": 120,
				"altitude": 30
			}
		}
	},
	"version": "1.0.0",
	"name": "svgText-writing-mode",
	"viewSource": {
		"x": 0,
		"y": 0,
		"width": 1024,
		"height": 1024
	},
	"rasterResolution": 144
}