{
	"children": [
		{
			"type": "text",
			"visible": true,
			"style": {
				"font-size": 30,
				"stroke": {
					"type": "none"
				}
			},
			"name": "Text.svg",
			"visualBounds": {
				"x": 232,
				"y": 314,
				"width": 54,
				"height": 47
			},
			"position": {
				"x": 0,
				"y": 0,
				"unitY": "px",
				"unitX": "px"
			},
			"maxTextSize": 30,
			"transform": {
				"a": 0.707107,
				"b": -0.707107,
				"c": 0.707107,
				"d": 0.707107,
				"tx": 0,
				"ty": 0
			},
			"transformTX": 246.896664,
			"transformTY": 366.186822,
			"children": [
				{
					"type": "tspan",
					"visible": true,
					"style": {
						"font-size": 30,
						"font-family": "Arial"
					},
					"text": "Text",
					"visualBounds": {
						"x": 232,
						"y": 314,
						"width": 54,
						"height": 47
					},
					"position": {
						"x": 0,
						"y": 0,
						"unitX": "px",
						"unitY": "em"
					}
				}
			]
		},
		{
			"type": "shape",
			"visible": true,
			"style": {
				"stroke": {
					"type": "solid",
					"align": "inside",
					"cap": "butt",
					"join": "miter",
					"width": 3,
					"miterLimit": 100,
					"dash": [],
					"dashOffset": 0,
					"color": {
						"mode": "RGB",
						"value": {
							"r": 241.881842,
							"g": 101.179413,
							"b": 33.72992
						},
						"alpha": 1
					},
					"opacity": 1
				}
			},
			"shape": {
				"type": "rect",
				"x": 208,
				"y": 275,
				"width": 98,
				"height": 121
			},
			"visualBounds": {
				"x": 208,
				"y": 275,
				"width": 98,
				"height": 121
			}
		}
	],
	"resources": {
		"clipPaths": {},
		"filters": {},
		"gradients": {},
		"masks": {},
		"patterns": {}
	},
	"artboards": {},
	"meta": {
		"PS": {
			"globalLight": {
				"angle": 120,
				"altitude": 30
			}
		}
	},
	"version": "1.0.0",
	"name": "text-transform.psd",
	"viewSource": {
		"x": 0,
		"y": 0,
		"width": 800,
		"height": 600
	},
	"rasterResolution": 72
}