{
	"children": [
		{
			"type": "text",
			"visible": true,
			"style": {
				"font-size": 150,
				"stroke": {
					"type": "none"
				}
			},
			"name": "more path text.svg",
			"visualBounds": {
				"x": -82.19421249999999,
				"y": -80.8879375,
				"width": 598.6046125,
				"height": 476.00329583333337
			},
			"position": {
				"x": 0,
				"y": 0
			},
			"children": [
				{
					"type": "textPath",
					"visible": true,
					"style": {
						"text-anchor": "end",
						"font-size": 150
					},
					"pathData": "M 360.72 269.76 C 390.941 269.76 415.44 284.803 415.44 303.36 C 415.44 321.917 390.941 336.96 360.72 336.96 C 330.499 336.96 306 321.917 306 303.36 Z",
					"children": [
						{
							"type": "tspan",
							"visible": true,
							"style": {
								"text-anchor": "end",
								"font-size": 150,
								"fill": {
									"type": "solid",
									"color": {
										"mode": "RGB",
										"value": {
											"r": 34.412245,
											"g": 107.000556,
											"b": 37.821601
										},
										"alpha": 1
									}
								},
								"font-family": "Optima",
								"font-weight": 900
							},
							"text": "more path text ",
							"visualBounds": {
								"x": 1192,
								"y": 1042,
								"width": 600,
								"height": 478
							},
							"position": {
								"x": 0,
								"y": 0,
								"unitX": "px",
								"unitY": "em"
							}
						}
					]
				}
			],
			"maxTextSize": 150
		}
	],
	"resources": {
		"clipPaths": {},
		"filters": {},
		"gradients": {},
		"masks": {},
		"patterns": {}
	},
	"artboards": {},
	"meta": {
		"PS": {
			"globalLight": {
				"angle": 90,
				"altitude": 30
			}
		}
	},
	"version": "1.0.0",
	"name": "text-on-path-2.psd",
	"viewSource": {
		"x": 0,
		"y": 0,
		"width": 2100,
		"height": 1500
	},
	"rasterResolution": 300
}