{
	"children": [
		{
			"id": "shape-1",
			"type": "shape",
			"visible": true,
			"style": {
				"stroke": {
					"type": "solid",
					"cap": "butt",
					"join": "miter",
					"width": 14,
					"miterLimit": 100,
					"dash": [],
					"dashOffset": 0,
					"color": {
						"mode": "RGB",
						"value": {
							"r": 0,
							"g": 0.091882,
							"b": 0.102416
						},
						"alpha": 1
					},
					"opacity": 1
				},
				"fill": {
					"type": "solid",
					"color": {
						"mode": "RGB",
						"value": {
							"r": 0,
							"g": 113.686632,
							"b": 187.776986
						},
						"alpha": 1
					}
				}
			},
			"name": "Rectangle 1",
			"visualBounds": {
				"x": 130,
				"y": 66,
				"width": 179,
				"height": 179
			},
			"shape": {
				"type": "rect",
				"x": 130,
				"y": 66,
				"width": 179,
				"height": 179
			}
		},
		{
			"id": "shape-2",
			"type": "shape",
			"visible": true,
			"style": {
				"stroke": {
					"type": "none",
					"cap": "butt",
					"join": "miter",
					"width": 3,
					"miterLimit": 100,
					"dash": [],
					"dashOffset": 0,
					"color": {
						"mode": "RGB",
						"value": {
							"r": 0,
							"g": 0.091882,
							"b": 0.102416
						},
						"alpha": 1
					},
					"opacity": 1
				},
				"fill": {
					"type": "solid",
					"color": {
						"mode": "RGB",
						"value": {
							"r": 237.272538,
							"g": 28.469096,
							"b": 36.259087
						},
						"alpha": 1
					}
				},
				"clipPath": {
					"ref": "clipPath1"
				}
			},
			"name": "Ellipse 1",
			"visualBounds": {
				"x": 215,
				"y": 151,
				"width": 188,
				"height": 188
			},
			"shape": {
				"type": "circle",
				"cx": 309,
				"cy": 245,
				"r": 94
			}
		}
	],
	"artboards": {},
	"meta": {},
	"name": "ClipPath test",
	"rasterResolution": 72,
	"version": "1.5.0",
	"viewSource": {
		"x": 0,
		"y": 0,
		"width": 1024,
		"height": 768
	},
	"resources": {
		"clipPaths": {
			"clipPath1": {
				"children": [
					{
						"id": "shape-3",
						"type": "shape",
						"visible": true,
						"style": {
							"stroke": {
								"type": "solid",
								"cap": "butt",
								"join": "miter",
								"width": 14,
								"miterLimit": 100,
								"dash": [],
								"dashOffset": 0,
								"color": {
									"mode": "RGB",
									"value": {
										"r": 0,
										"g": 0.091882,
										"b": 0.102416
									},
									"alpha": 1
								},
								"opacity": 1
							},
							"fill": {
								"type": "solid",
								"color": {
									"mode": "RGB",
									"value": {
										"r": 0,
										"g": 113.686632,
										"b": 187.776986
									},
									"alpha": 1
								}
							}
						},
						"name": "Rectangle 1",
						"visualBounds": {
							"x": 130,
							"y": 67,
							"width": 179,
							"height": 178
						},
						"shape": {
							"type": "rect",
							"x": 130,
							"y": 67,
							"width": 179,
							"height": 179
						}
					}
				],
				"type": "clipPath"
			}
		},
		"filters": {},
		"gradients": {},
		"masks": {},
		"patterns": {}
	}
}