{
	"children": [
		{
			"type": "shape",
			"visible": true,
			"style": {
				"stroke": {
					"type": "none"
				},
				"fill": {
					"type": "solid",
					"color": {
						"mode": "RGB",
						"value": {
							"r": 62.809338,
							"g": 144.252921,
							"b": 182.000004
						},
						"alpha": 1
					}
				}
			},
			"shape": {
				"type": "rect",
				"x": 70,
				"y": 100,
				"width": 338,
				"height": 163
			},
			"visualBounds": {
				"x": 70,
				"y": 100,
				"width": 338,
				"height": 163
			}
		},
		{
			"type": "shape",
			"visible": true,
			"style": {
				"stroke": {
					"type": "none"
				},
				"fill": {
					"type": "solid",
					"color": {
						"mode": "RGB",
						"value": {
							"r": 62.809338,
							"g": 144.252921,
							"b": 182.000004
						},
						"alpha": 1
					}
				}
			},
			"shape": {
				"type": "rect",
				"x": 500,
				"y": 100,
				"width": 300,
				"height": 150,
				"r": [
					30,
					30,
					30,
					30
				]
			},
			"visualBounds": {
				"x": 500,
				"y": 100,
				"width": 300,
				"height": 150
			}
		},
		{
			"type": "shape",
			"visible": true,
			"style": {
				"stroke": {
					"type": "none"
				},
				"fill": {
					"type": "solid",
					"color": {
						"mode": "RGB",
						"value": {
							"r": 62.809338,
							"g": 144.252921,
							"b": 182.000004
						},
						"alpha": 1
					}
				}
			},
			"shape": {
				"type": "rect",
				"x": 70,
				"y": 300,
				"width": 300,
				"height": 150,
				"r": [
					40,
					10,
					20,
					30
				]
			},
			"visualBounds": {
				"x": 70,
				"y": 300,
				"width": 300,
				"height": 150
			}
		},
		{
			"type": "shape",
			"visible": true,
			"style": {
				"stroke": {
					"type": "none"
				},
				"fill": {
					"type": "solid",
					"color": {
						"mode": "RGB",
						"value": {
							"r": 62.809338,
							"g": 144.252921,
							"b": 182.000004
						},
						"alpha": 1
					}
				}
			},
			"shape": {
				"type": "rect",
				"x": 380,
				"y": 300,
				"width": 300,
				"height": 150,
				"r": [
					20,
					10,
					200,
					150
				]
			},
			"visualBounds": {
				"x": 380,
				"y": 300,
				"width": 300,
				"height": 150
			}
		}
	],
	"resources": {
		"clipPaths": {},
		"filters": {},
		"gradients": {},
		"masks": {},
		"patterns": {}
	},
	"artboards": {},
	"meta": {
		"PS": {
			"globalLight": {
				"angle": 120,
				"altitude": 30
			}
		}
	},
	"version": "1.0.0",
	"name": "rect.psd",
	"viewSource": {
		"x": 0,
		"y": 0,
		"width": 1024,
		"height": 1024
	},
	"rasterResolution": 144
}