{
	"children": [
		{
			"id": "id_1",
			"transform": {
				"a": 1,
				"b": 0,
				"c": 0,
				"d": -1,
				"tx": 0,
				"ty": 560
			},
			"type": "group",
			"visualBounds": {
				"x": 0,
				"y": 0,
				"width": 121,
				"height": 92
			},
			"group": {
				"children": [
					{
						"id": "id_1_1",
						"shape": {
							"path": "M0.000000,468.000000 L121.000000,468.000000 L121.000000,560.000000 L0.000000,560.000000 z",
							"type": "path"
						},
						"style": {
							"fill": {
								"color": {
									"mode": "RGB",
									"value": {
										"r": 0,
										"g": 255,
										"b": 0
									},
									"alpha": 1
								},
								"type": "solid"
							}
						},
						"type": "shape",
						"visualBounds": {
							"x": 0,
							"y": 468,
							"width": 121,
							"height": 92
						}
					}
				]
			}
		}
	],
	"name": "Group transform",
	"rasterResolution": 72,
	"version": "1.0.0",
	"viewSource": {
		"x": 0,
		"y": 0,
		"width": 960,
		"height": 560
	},
	"colorMode": "sRGB",
	"resources": {
		"gradients": {},
		"masks": {},
		"patterns": {},
		"styles": {}
	}
}