{
	"children": [
		{
			"type": "group",
			"group": {
				"children": [
					{
						"name": "Button_over",
						"type": "group",
						"group": {
							"children": [
								{
									"name": "Home",
									"type": "group",
									"group": {
										"children": []
									}
								}
							]
						}
					},
					{
						"name": "Button_over2",
						"type": "group",
						"group": {
							"children": [
								{
									"name": "Home2",
									"type": "group",
									"group": {
										"children": []
									}
								}
							]
						}
					}
				]
			}
		}
	],
	"desc": "Created by Adobe Illustrator",
	"name": "ExpandDeletedSymbol2",
	"version": "1.5.0",
	"viewSource": {
		"x": 0,
		"y": 0,
		"width": 960,
		"height": 560
	},
	"resources": {}
}