{
	"children": [
		{
			"type": "artboard",
			"visible": true,
			"style": {
				"stroke": {
					"type": "none"
				}
			},
			"artboard": {
				"ref": "artboard",
				"children": [
					{
						"type": "shape",
						"visible": true,
						"style": {
							"stroke": {
								"type": "none"
							},
							"fill": {
								"type": "solid",
								"color": {
									"mode": "RGB",
									"value": {
										"r": 0,
										"g": 255,
										"b": 0
									},
									"alpha": 1
								}
							}
						},
						"shape": {
							"type": "circle",
							"cx": 2540,
							"cy": 2960,
							"r": 393
						},
						"visualBounds": {
							"x": 2147,
							"y": 2567,
							"width": 786,
							"height": 786
						}
					}
				]
			},
			"name": "square"
		},
		{
			"type": "artboard",
			"visible": true,
			"style": {
				"stroke": {
					"type": "none"
				}
			},
			"artboard": {
				"ref": "artboard-2",
				"children": [
					{
						"type": "shape",
						"visible": true,
						"style": {
							"stroke": {
								"type": "none"
							},
							"fill": {
								"type": "solid",
								"color": {
									"mode": "RGB",
									"value": {
										"r": 0,
										"g": 255,
										"b": 0
									},
									"alpha": 1
								}
							}
						},
						"shape": {
							"type": "rect",
							"x": 3972,
							"y": 2811,
							"width": 533,
							"height": 533
						},
						"visualBounds": {
							"x": 3972,
							"y": 2811,
							"width": 533,
							"height": 533
						}
					}
				]
			},
			"name": "iPhone"
		}
	],
	"resources": {
		"clipPaths": {},
		"filters": {},
		"gradients": {},
		"masks": {},
		"patterns": {}
	},
	"artboards": {
		"artboard": {
			"name": "square",
			"x": 2000,
			"y": 2000,
			"width": 1080,
			"height": 1920
		},
		"artboard-2": {
			"name": "iPhone",
			"x": 3658,
			"y": 2497,
			"width": 1162,
			"height": 1162
		}
	},
	"meta": {
		"PS": {
			"globalLight": {
				"angle": 90,
				"altitude": 30
			}
		}
	},
	"version": "1.0.0",
	"viewSource": {
		"x": 0,
		"y": 0,
		"width": 5080,
		"height": 5920
	},
	"rasterResolution": 326
}