{
	"children": [],
	"resources": {
		"clipPaths": {},
		"filters": {},
		"gradients": {},
		"masks": {},
		"patterns": {}
	},
	"artboards": {},
	"meta": {
		"PS": {
			"globalLight": {
				"angle": 120,
				"altitude": 30
			}
		}
	},
	"version": "1.0.0",
	"name": "pixelImage.psd",
	"viewSource": {
		"x": 0,
		"y": 0,
		"width": 100,
		"height": 100
	},
	"rasterResolution": 72
}