{
	"children": [
		{
			"type": "shape",
			"style": {
				"fill": {
					"type": "solid",
					"color": {
						"mode": "RGB",
						"value": {
							"r": 0,
							"g": 0,
							"b": 127
						},
						"alpha": 0.5
					}
				},
				"clipPath": {
					"ref": "clipPath1"
				}
			},
			"visualBounds": {
				"x": 50,
				"y": 50,
				"width": 150,
				"height": 150
			},
			"shape": {
				"type": "rect",
				"x": 50,
				"y": 50,
				"width": 100,
				"height": 100
			}
		},
		{
			"type": "shape",
			"style": {
				"fill": {
					"type": "solid",
					"color": {
						"mode": "RGB",
						"value": {
							"r": 0,
							"g": 127,
							"b": 0
						},
						"alpha": 0.5
					}
				},
				"clipPath": {
					"ref": "clipPath1"
				}
			},
			"visualBounds": {
				"x": 50,
				"y": 50,
				"width": 150,
				"height": 150
			},
			"shape": {
				"type": "path",
				"path": "M50,50 L150,50 L150,150 L50,150 z"
			}
		}
	],
	"artboards": {},
	"viewSource": {
		"x": 0,
		"y": 0,
		"width": 1024,
		"height": 768
	},
	"version": "1.0.0",
	"resources": {
		"masks": {},
		"filters": {},
		"gradients": {},
		"clipPaths": {
			"clipPath1": {
				"children": [
					{
						"type": "shape",
						"visualBounds": {
							"x": 50,
							"y": 50,
							"width": 100,
							"height": 100
						},
						"shape": {
							"type": "circle",
							"cx": 100,
							"cy": 100,
							"r": 50
						}
					}
				],
				"type": "clipPath"
			}
		},
		"patterns": {}
	}
}