{
	"children": [
		{
			"type": "shape",
			"visible": true,
			"style": {
				"stroke": {
					"type": "none",
					"align": "inside",
					"cap": "butt",
					"join": "miter",
					"width": 13.583333333333332,
					"miterLimit": 100,
					"dash": [],
					"dashOffset": 0,
					"color": {
						"mode": "RGB",
						"value": {
							"r": 0,
							"g": 0,
							"b": 0
						},
						"alpha": 1
					},
					"opacity": 1
				},
				"fill": {
					"type": "gradient",
					"gradient": {
						"units": "userSpaceOnUse",
						"x1": 0,
						"y1": 2512,
						"x2": 5924,
						"y2": 2512,
						"ref": "linear-gradient"
					}
				}
			},
			"shape": {
				"type": "path",
				"path": "M4000 2212 C4000 2212 4600 2212 4600 2212 C4600 2212 4600 2812 4600 2812 C4600 2812 4000 2812 4000 2812 C4000 2812 4000 2212 4000 2212Z",
				"winding": "evenodd"
			},
			"visualBounds": {
				"x": 4000,
				"y": 2212,
				"width": 600,
				"height": 600
			}
		}
	],
	"resources": {
		"clipPaths": {},
		"filters": {},
		"gradients": {
			"linear-gradient": {
				"stops": [
					{
						"offset": 0,
						"color": {
							"mode": "RGB",
							"value": {
								"r": 249,
								"g": 229.99611,
								"b": 0
							},
							"alpha": 1
						}
					},
					{
						"offset": 0.050048828125,
						"color": {
							"mode": "RGB",
							"value": {
								"r": 249,
								"g": 229.99611,
								"b": 0
							}
						}
					},
					{
						"offset": 0.35009765625,
						"color": {
							"mode": "RGB",
							"value": {
								"r": 111.003892,
								"g": 21.003892,
								"b": 108.000001
							}
						}
					},
					{
						"offset": 0.64990234375,
						"color": {
							"mode": "RGB",
							"value": {
								"r": 253,
								"g": 124,
								"b": 0
							}
						}
					},
					{
						"offset": 0.949951171875,
						"color": {
							"mode": "RGB",
							"value": {
								"r": 0,
								"g": 40.000001,
								"b": 116.000001
							}
						}
					},
					{
						"offset": 1,
						"color": {
							"mode": "RGB",
							"value": {
								"r": 0,
								"g": 40.000001,
								"b": 116.000001
							},
							"alpha": 1
						}
					}
				],
				"type": "linear"
			}
		},
		"masks": {},
		"patterns": {}
	},
	"artboards": {},
	"meta": {
		"PS": {
			"globalLight": {
				"angle": 90,
				"altitude": 30
			}
		}
	},
	"version": "1.0.0",
	"name": "Untitled-1",
	"viewSource": {
		"x": 0,
		"y": 0,
		"width": 5924,
		"height": 5024
	},
	"rasterResolution": 326
}