{
	"children": [
		{
			"type": "group",
			"visible": true,
			"style": {
				"opacity": 0.35,
				"isolation": "isolate",
				"blendMode": "multiply",
				"stroke": {
					"type": "none"
				}
			},
			"name": "Group",
			"group": {
				"children": [
					{
						"type": "shape",
						"visible": true,
						"style": {
							"stroke": {
								"type": "solid",
								"align": "inside",
								"cap": "butt",
								"join": "miter",
								"width": 3,
								"dash": [],
								"dashOffset": 0,
								"color": {
									"mode": "RGB",
									"value": {
										"r": 241.881842,
										"g": 101.179413,
										"b": 33.72992
									},
									"alpha": 1
								},
								"opacity": 1,
								"miterLimit": 100
							},
							"fill": {
								"type": "solid",
								"color": {
									"mode": "RGB",
									"value": {
										"r": 43.785993,
										"g": 207.000003,
										"b": 38.155641
									},
									"alpha": 1
								}
							}
						},
						"visualBounds": {
							"x": 100,
							"y": 100,
							"width": 200,
							"height": 200
						},
						"shape": {
							"type": "rect",
							"x": 100,
							"y": 100,
							"width": 200,
							"height": 200
						}
					}
				]
			}
		}
	],
	"artboards": {},
	"version": "0.1.0",
	"name": "group.psd",
	"viewSource": {
		"x": 0,
		"y": 0,
		"width": 800,
		"height": 600
	},
	"resources": {
		"clipPaths": {},
		"filters": {},
		"gradients": {},
		"masks": {},
		"patterns": {}
	},
	"rasterResolution": 72
}