{
	"name": "generatedAsset",
	"version": "1.5.0",
	"children": [
		{
			"type": "shape",
			"shape": {
				"type": "ellipse",
				"cx": 105,
				"cy": 155,
				"ry": 150,
				"rx": 100
			},
			"style": {
				"stroke": {
					"width": 10,
					"type": "solid",
					"color": {
						"mode": "RGB",
						"value": {
							"r": 0,
							"g": 127,
							"b": 0
						}
					}
				}
			},
			"visualBounds": {
				"x": 0,
				"y": 0,
				"width": 310,
				"height": 210
			}
		}
	],
	"viewSource": {
		"x": 0,
		"y": 0,
		"width": 400,
		"height": 400
	},
	"resources": {}
}