{
	"children": [
		{
			"id": "id_1",
			"transform": {
				"a": 1,
				"b": 0,
				"c": 0,
				"d": -1,
				"tx": 0,
				"ty": 560
			},
			"type": "group",
			"visualBounds": {
				"x": 7,
				"y": 496.7040100097656,
				"width": 161.33599853515625,
				"height": 63.295989990234375
			},
			"group": {
				"children": [
					{
						"id": "id_1_1",
						"style": {
							"clipPath": {
								"ref": "id_1_1_m"
							}
						},
						"type": "group",
						"visualBounds": {
							"x": 7,
							"y": 0,
							"width": 161.33599853515625,
							"height": 63.295997619628906
						},
						"group": {
							"children": [
								{
									"id": "id_1_1_1",
									"shape": {
										"path": "M7.000000,63.295998 L168.335999,63.295998 L168.335999,-0.000002 L7.000000,-0.000002 z",
										"type": "path"
									},
									"style": {
										"fill": {
											"gradient": {
												"ref": "grad_1",
												"cx": 0,
												"cy": 0,
												"fx": -1,
												"fy": 0.0006173209985718131,
												"r": 1,
												"transform": {
													"a": 61.285545349121094,
													"b": 0,
													"c": 0,
													"d": -61.285545349121094,
													"tx": 87.66798400878906,
													"ty": 31.602243423461914
												}
											},
											"type": "gradient"
										}
									},
									"type": "shape",
									"visualBounds": {
										"x": 7,
										"y": 0,
										"width": 161.33599853515625,
										"height": 63.295997619628906
									}
								}
							]
						}
					}
				]
			}
		}
	],
	"name": "rect.ai",
	"version": "1.0.0",
	"colorMode": "sRGB",
	"rasterResolution": 72,
	"viewSource": {
		"x": 0,
		"y": 0,
		"width": 960,
		"height": 560
	},
	"resources": {
		"clipPaths": {
			"id_1_1_m": {
				"children": [
					{
						"id": "id_1_1_m_shape",
						"shape": {
							"path": "M7.000000,31.603001 C7.000000,14.916000 39.820000,1.241000 81.483002,0.000000 L93.853996,0.000000 C135.516998,1.241000 168.335999,14.916000 168.335999,31.603001 C168.335999,49.106998 132.220001,63.296001 87.667999,63.296001 C43.116001,63.296001 7.000000,49.106998 7.000000,31.603001",
							"type": "path"
						},
						"type": "shape",
						"style": {
							"fill": {
								"type": "solid",
								"color": {
									"mode": "RGB",
									"value": {
										"r": 0,
										"g": 0,
										"b": 0
									},
									"alpha": 1
								}
							}
						}
					}
				],
				"type": "clipPath"
			}
		},
		"gradients": {
			"grad_1": {
				"stops": [
					{
						"color": {
							"mode": "RGB",
							"value": {
								"r": 0,
								"g": 0,
								"b": 255
							}
						},
						"offset": 0
					},
					{
						"color": {
							"mode": "RGB",
							"value": {
								"r": 0,
								"g": 0,
								"b": 255
							}
						},
						"offset": 0.13105900585651398
					},
					{
						"color": {
							"mode": "RGB",
							"value": {
								"r": 255,
								"g": 255,
								"b": 255
							}
						},
						"offset": 0.47108200192451477
					},
					{
						"color": {
							"mode": "RGB",
							"value": {
								"r": 255,
								"g": 147,
								"b": 29
							}
						},
						"offset": 1
					}
				],
				"type": "radial"
			}
		},
		"masks": {},
		"patterns": {},
		"styles": {}
	}
}