{
	"children": [
		{
			"type": "shape",
			"visible": true,
			"style": {
				"stroke": {
					"type": "none"
				},
				"fill": {
					"type": "gradient",
					"gradient": {
						"units": "userSpaceOnUse",
						"r": 150,
						"cx": 450,
						"cy": 175,
						"ref": "radial-gradient"
					}
				}
			},
			"shape": {
				"type": "rect",
				"x": 300,
				"y": 100,
				"width": 300,
				"height": 150
			},
			"visualBounds": {
				"x": 300,
				"y": 100,
				"width": 300,
				"height": 150
			}
		},
		{
			"type": "shape",
			"visible": true,
			"style": {
				"stroke": {
					"type": "none"
				},
				"fill": {
					"type": "gradient",
					"gradient": {
						"units": "userSpaceOnUse",
						"r": 500,
						"cx": 500,
						"cy": 375,
						"ref": "radial-gradient-2"
					}
				}
			},
			"shape": {
				"type": "rect",
				"x": 50,
				"y": 350,
				"width": 900,
				"height": 150
			},
			"visualBounds": {
				"x": 50,
				"y": 350,
				"width": 900,
				"height": 150
			}
		}
	],
	"resources": {
		"clipPaths": {},
		"filters": {},
		"gradients": {
			"radial-gradient": {
				"stops": [
					{
						"offset": 0,
						"color": {
							"mode": "RGB",
							"value": {
								"r": 41.003892,
								"g": 10,
								"b": 89.003893
							},
							"alpha": 1
						}
					},
					{
						"offset": 1,
						"color": {
							"mode": "RGB",
							"value": {
								"r": 255,
								"g": 124,
								"b": 0
							},
							"alpha": 1
						}
					}
				],
				"type": "radial"
			},
			"radial-gradient-2": {
				"stops": [
					{
						"offset": 0,
						"color": {
							"mode": "RGB",
							"value": {
								"r": 41.003892,
								"g": 10,
								"b": 89.003893
							},
							"alpha": 1
						}
					},
					{
						"offset": 1,
						"color": {
							"mode": "RGB",
							"value": {
								"r": 255,
								"g": 124,
								"b": 0
							},
							"alpha": 1
						}
					}
				],
				"type": "radial"
			}
		},
		"masks": {},
		"patterns": {}
	},
	"artboards": {},
	"meta": {
		"PS": {
			"globalLight": {
				"angle": 120,
				"altitude": 30
			}
		}
	},
	"version": "1.0.0",
	"name": "svgGradient-radial.psd",
	"viewSource": {
		"x": 0,
		"y": 0,
		"width": 1000,
		"height": 750
	},
	"rasterResolution": 144
}