{
	"children": [
		{
			"group": {
				"children": [
					{
						"text": {
							"paragraphs": [
								{
									"lines": [
										[
											{
												"from": 0,
												"style": {
													"fill": {
														"color": {
															"value": {
																"b": 0,
																"g": 0,
																"r": 0
															},
															"mode": "RGB"
														},
														"type": "solid"
													},
													"font": {
														"family": "Myriad Pro",
														"size": 24,
														"style": "regular"
													},
													"textAttributes": {
														"letterSpacing": 96
													}
												},
												"to": 8
											}
										]
									],
									"style": {
										"font": {
											"size": 12
										}
									}
								}
							],
							"rawText": "Tracking",
							"frame": {
								"type": "positioned",
								"height": 26.0874,
								"path": "",
								"width": 853.727
							}
						},
						"transform": {
							"a": 1,
							"b": 0,
							"c": 0,
							"d": 1,
							"tx": 66.9976,
							"ty": 294.503
						},
						"type": "text",
						"visualBounds": {
							"height": 26.087,
							"x": 66.9736,
							"width": 853.7264,
							"y": 274.416
						}
					}
				]
			},
			"type": "group"
		}
	],
	"resources": {},
	"desc": "Created by Adobe Illustrator",
	"viewSource": {
		"height": 560,
		"x": 0,
		"width": 960,
		"y": 0
	},
	"name": "Tracking2",
	"version": "0.1.0"
}