{
	"children": [
		{
			"type": "artboard",
			"visible": true,
			"style": {
				"stroke": {
					"type": "none"
				}
			},
			"name": "Artboard 1",
			"artboard": {
				"ref": "artboard-1",
				"children": [
					{
						"id": "shape-1",
						"type": "shape",
						"visible": true,
						"style": {
							"stroke": {
								"type": "none"
							},
							"fill": {
								"type": "gradient",
								"gradient": {
									"ref": "radial-gradient-1",
									"units": "userSpaceOnUse",
									"r": 100,
									"cx": 900,
									"cy": 900
								}
							}
						},
						"name": "Ellipse 1",
						"visualBounds": {
							"x": 800,
							"y": 800,
							"width": 200,
							"height": 200
						},
						"shape": {
							"type": "circle",
							"cx": 900,
							"cy": 900,
							"r": 100
						}
					},
					{
						"id": "shape-2",
						"type": "shape",
						"visible": true,
						"style": {
							"stroke": {
								"type": "none"
							},
							"fill": {
								"type": "gradient",
								"gradient": {
									"ref": "radial-gradient-2",
									"units": "userSpaceOnUse",
									"r": 100,
									"cx": 1300,
									"cy": 900
								}
							}
						},
						"name": "Ellipse 2",
						"visualBounds": {
							"x": 1200,
							"y": 800,
							"width": 200,
							"height": 200
						},
						"shape": {
							"type": "circle",
							"cx": 1300,
							"cy": 900,
							"r": 100
						}
					},
					{
						"id": "shape-3",
						"type": "shape",
						"visible": true,
						"style": {
							"stroke": {
								"type": "none"
							},
							"fill": {
								"type": "gradient",
								"gradient": {
									"ref": "radial-gradient-3",
									"units": "userSpaceOnUse",
									"r": 100,
									"cx": 900,
									"cy": 1300
								}
							}
						},
						"name": "Ellipse 3",
						"visualBounds": {
							"x": 800,
							"y": 1200,
							"width": 200,
							"height": 200
						},
						"shape": {
							"type": "circle",
							"cx": 900,
							"cy": 1300,
							"r": 100
						}
					},
					{
						"id": "shape-4",
						"type": "shape",
						"visible": true,
						"style": {
							"stroke": {
								"type": "none"
							},
							"fill": {
								"type": "gradient",
								"gradient": {
									"ref": "radial-gradient-4",
									"units": "userSpaceOnUse",
									"r": 100,
									"cx": 1300,
									"cy": 1300
								}
							}
						},
						"name": "Ellipse 4",
						"visualBounds": {
							"x": 1200,
							"y": 1200,
							"width": 200,
							"height": 200
						},
						"shape": {
							"type": "circle",
							"cx": 1300,
							"cy": 1300,
							"r": 100
						}
					}
				]
			}
		}
	],
	"artboards": {
		"artboard-1": {
			"name": "Artboard 1",
			"x": 900,
			"y": 900,
			"width": 400,
			"height": 400
		}
	},
	"meta": {
		"PS": {
			"globalLight": {
				"angle": 90,
				"altitude": 30
			}
		}
	},
	"name": "artboard-cropping.psd",
	"rasterResolution": 72,
	"version": "1.5.0",
	"viewSource": {
		"x": 0,
		"y": 0,
		"width": 2200,
		"height": 2200
	},
	"resources": {
		"clipPaths": {},
		"filters": {},
		"gradients": {
			"radial-gradient-1": {
				"stops": [
					{
						"offset": 0,
						"color": {
							"mode": "RGB",
							"value": {
								"r": 9.57588,
								"g": 0.00389105,
								"b": 178
							},
							"alpha": 1
						}
					},
					{
						"offset": 0.5,
						"color": {
							"mode": "RGB",
							"value": {
								"r": 255,
								"g": 0.00389105,
								"b": 0.0272374
							}
						}
					},
					{
						"offset": 1,
						"color": {
							"mode": "RGB",
							"value": {
								"r": 255,
								"g": 251.996,
								"b": 0.00389105
							},
							"alpha": 1
						}
					}
				],
				"type": "radial"
			},
			"radial-gradient-2": {
				"stops": [
					{
						"offset": 0,
						"color": {
							"mode": "RGB",
							"value": {
								"r": 9.57588,
								"g": 0.00389105,
								"b": 178
							},
							"alpha": 1
						}
					},
					{
						"offset": 0.5,
						"color": {
							"mode": "RGB",
							"value": {
								"r": 255,
								"g": 0.00389105,
								"b": 0.0272374
							}
						}
					},
					{
						"offset": 1,
						"color": {
							"mode": "RGB",
							"value": {
								"r": 255,
								"g": 251.996,
								"b": 0.00389105
							},
							"alpha": 1
						}
					}
				],
				"type": "radial"
			},
			"radial-gradient-3": {
				"stops": [
					{
						"offset": 0,
						"color": {
							"mode": "RGB",
							"value": {
								"r": 9.57588,
								"g": 0.00389105,
								"b": 178
							},
							"alpha": 1
						}
					},
					{
						"offset": 0.5,
						"color": {
							"mode": "RGB",
							"value": {
								"r": 255,
								"g": 0.00389105,
								"b": 0.0272374
							}
						}
					},
					{
						"offset": 1,
						"color": {
							"mode": "RGB",
							"value": {
								"r": 255,
								"g": 251.996,
								"b": 0.00389105
							},
							"alpha": 1
						}
					}
				],
				"type": "radial"
			},
			"radial-gradient-4": {
				"stops": [
					{
						"offset": 0,
						"color": {
							"mode": "RGB",
							"value": {
								"r": 9.57588,
								"g": 0.00389105,
								"b": 178
							},
							"alpha": 1
						}
					},
					{
						"offset": 0.5,
						"color": {
							"mode": "RGB",
							"value": {
								"r": 255,
								"g": 0.00389105,
								"b": 0.0272374
							}
						}
					},
					{
						"offset": 1,
						"color": {
							"mode": "RGB",
							"value": {
								"r": 255,
								"g": 251.996,
								"b": 0.00389105
							},
							"alpha": 1
						}
					}
				],
				"type": "radial"
			}
		},
		"masks": {},
		"patterns": {}
	}
}