{
	"children": [
		{
			"type": "shape",
			"visible": true,
			"style": {
				"stroke": {
					"type": "none"
				},
				"fill": {
					"type": "solid",
					"color": {
						"mode": "RGB",
						"value": {
							"r": 0,
							"g": 255,
							"b": 0
						},
						"alpha": 1
					}
				}
			},
			"shape": {
				"type": "circle",
				"cx": 2512,
				"cy": 2512,
				"r": 387
			},
			"visualBounds": {
				"x": 2125,
				"y": 2125,
				"width": 774,
				"height": 774
			}
		}
	],
	"resources": {
		"clipPaths": {},
		"filters": {},
		"gradients": {},
		"masks": {},
		"patterns": {}
	},
	"artboards": {},
	"meta": {
		"PS": {
			"globalLight": {
				"angle": 90,
				"altitude": 30
			}
		}
	},
	"version": "1.0.0",
	"viewSource": {
		"x": 0,
		"y": 0,
		"width": 5024,
		"height": 5024
	},
	"rasterResolution": 326
}