{
	"children": [
		{
			"id": "shape-1",
			"type": "shape",
			"visible": true,
			"style": {
				"stroke": {
					"type": "none"
				},
				"fill": {
					"type": "gradient",
					"gradient": {
						"ref": "radial-gradient-1",
						"units": "userSpaceOnUse",
						"r": 100,
						"cx": 1300,
						"cy": 900
					}
				}
			},
			"name": "Ellipse 2",
			"visualBounds": {
				"x": 1200,
				"y": 800,
				"width": 200,
				"height": 200
			},
			"shape": {
				"type": "circle",
				"cx": 1300,
				"cy": 900,
				"r": 100
			}
		}
	],
	"artboards": {},
	"meta": {
		"PS": {
			"globalLight": {
				"angle": 90,
				"altitude": 30
			}
		}
	},
	"rasterResolution": 72,
	"name": "artboard-cropping.psd",
	"version": "1.5.0",
	"viewSource": {
		"x": 0,
		"y": 0,
		"width": 2200,
		"height": 2200
	},
	"resources": {
		"clipPaths": {},
		"filters": {},
		"gradients": {
			"radial-gradient-1": {
				"stops": [
					{
						"offset": 0,
						"color": {
							"mode": "RGB",
							"value": {
								"r": 9.57588,
								"g": 0.00389105,
								"b": 178
							},
							"alpha": 1
						}
					},
					{
						"offset": 0.5,
						"color": {
							"mode": "RGB",
							"value": {
								"r": 255,
								"g": 0.00389105,
								"b": 0.0272374
							}
						}
					},
					{
						"offset": 1,
						"color": {
							"mode": "RGB",
							"value": {
								"r": 255,
								"g": 251.996,
								"b": 0.00389105
							},
							"alpha": 1
						}
					}
				],
				"type": "radial"
			}
		},
		"masks": {},
		"patterns": {}
	}
}